start,end,visual_event,voiceover_hint,emphasis
0.00,0.90,"A yellow line begins forming a loop","This is the cycle of OCD","cycle"
0.90,3.55,"Four parts of the loop appear as the line reaches them","An intrusive thought strikes, anxiety spikes, and a compulsion brings temporary relief","temporary relief"
3.55,5.18,"The playhead makes a faster second orbit and the loop thickens","But the relief feeds the loop","feeds the loop"
5.18,5.72,"The playhead stops at Anxiety; the frame holds","ERP breaks it right here","right here"
5.72,7.35,"A yellow-to-green path leaves the loop","By pausing and delaying the compulsion","delaying"
7.35,9.15,"The detour resolves into the Compulsion Delay timer","Patterns helps make that pause practical","Patterns"
9.15,11.70,"The timer aligns with the real Patterns Home screen","Track triggers and practice sitting with the urge privately","privately"
12.00,15.00,"Patterns CTA appears over the real app","Download Patterns and start building a different response","different response"
